14:47:20.524779 IP asusix.Home.51330 > 224.0.0.251.mdns: 41783+ [1au] A (QM)? shutter0.local. (55)
E..S......1....].........?.Q.7. .........shutter0.local.......).........
......\...
14:47:20.525816 IP shutter0.Home.mdns > asusix.Home.51330: 41783*- 1/0/0 A 192.168.1.83 (62)
E..Z..@.@......S...].....F.k.7...........shutter0.local......shutter0.local..............S

14:47:23.503445 IP asusix.Home.53047 > 224.0.0.251.mdns: 62358+ [1au] A (QM)? DS-KD8003-IME10120201127RRF17688364CVLU.local. (86)
E..r.9..../A...].....7...^.p... ........'DS-KD8003-IME10120201127RRF17688364CVLU.local.......).........
.........r
14:47:23.507061 IP 192.168.1.231.mdns > asusix.Home.53047: 62358- 1/0/0 A 192.168.1.231 (124)
E...L.@............]...7................'DS-KD8003-IME10120201127RRF17688364CVLU.local.....'DS-KD8003-IME10120201127RRF17688364CVLU.local........

